{
  "schema": "bubblevan/research-session/v1",
  "research_session_id": "rs-000000000000000000000001",
  "question": "Fixture research question",
  "seed_artifact_ids": [],
  "source_feed_run_id": null,
  "status": "draft",
  "created_at": "2026-09-30T00:00:00Z",
  "updated_at": "2026-09-30T00:00:00Z",
  "corpus_hash": null,
  "retrieval_config": {},
  "model_config": {},
  "prompt_hashes": {},
  "evidence_set_hash": null,
  "evidence_path": null,
  "brief_revision": 0,
  "reviewed_by": null,
  "reviewed_at": null,
  "approved_by": null,
  "approved_at": null,
  "promoted_path": null
}
